Keyword,Impr.,Avg. cost, Cost ,Clicks

map compliance software,24,8.11, $16.21 ,2

map compliance software,0,0, $-   ,0

map compliance software,0,0, $-   ,0

amazon map pricing,778,4.78, $138.59 ,29

map monitoring software,207,6.8, $40.81 ,6

stop unauthorized sellers,24,11.84, $11.84 ,1

map pricing software,139,6.06, $24.22 ,4

map compliance software,0,0, $-   ,0

brand protection ebay,0,0, $-   ,0

amazon brand protection,700,3.49, $73.29 ,21

brand protection agency,23,0, $-   ,0

brand enforcement,91,3.03, $18.16 ,6

brand protection ebay,1,0, $-   ,0

amazon brand registry,182,0, $-   ,0

brand monitoring agency,6,0, $-   ,0

brand monitoring walmart,0,0, $-   ,0

protecty your brand agency,0,0, $-   ,0

protecty your brand ebay ,0,0, $-   ,0

protect your brand online,0,0, $-   ,0

protect your brand outsourced,0,0, $-   ,0

brand protection walmart,0,0, $-   ,0

online brand protection,200,1.84, $1.84 ,1

brand protection companies,362,3.66, $21.97 ,6

brand protection firm,0,0, $-   ,0

protect your brand automated,0,0, $-   ,0

brand protection automation,0,0, $-   ,0

protecting your brand,"4,609",3.21, $253.79 ,79

brand gating amazon,111,2.55, $5.10 ,2

brand enforcement agency,7,0, $-   ,0

brand registry,"3,208",3.25, $296.11 ,91

brand protection amazon,6,0, $-   ,0

register your brand,14,3.78, $7.56 ,2

brand protection company,19,0, $-   ,0

brand enforcement amazon,14,3.27, $6.53 ,2

protect your brand company,0,0, $-   ,0

register my brand name,199,3.57, $32.13 ,9

brand gating amazon,22,0, $-   ,0

amazon brand protection,412,2.95, $2.95 ,1

brand registry amazon,10,0, $-   ,0

brand protection amazon,35,2.41, $2.41 ,1

protect your brand firm,0,0, $-   ,0

register your brand,433,3.28, $72.11 ,22

register your brand name,166,3.63, $29.00 ,8

brand protection,72,0, $-   ,0

brand protection companies,478,3.41, $30.71 ,9

brand gating on amazon,113,3.04, $3.04 ,1

protect your brand walmart,0,0, $-   ,0

protect your brand amazon,68,2.74, $2.74 ,1

brand protection outsourced,0,0, $-   ,0

amazon repricer map,1,2.61, $2.61 ,1

map policy amazon products,1,4.16, $4.16 ,1

how to check map on amazon,1,3.4, $3.40 ,1

amazon map control pricing,1,2.33, $2.33 ,1

how do i edit business pricing in bulk on amazon,1,4.14, $4.14 ,1

dispensary network mapping software,6,4.24, $8.48 ,2

amazon maps api pricing,3,7.64, $7.64 ,1

amazon does not follow map pricing,1,3.16, $3.16 ,1

how to track what time your amazon package on a map,1,3.43, $3.43 ,1

map policy with amazon,2,4.69, $4.69 ,1

minecraft network mapping software,4,5.45, $5.45 ,1

where to buy autocad map 3d software,1,3.56, $3.56 ,1

amazon map msrp,2,4.49, $4.49 ,1

how to manage map pricing woth amazon,1,2.61, $2.61 ,1

amazon map monitoring,1,7.68, $7.68 ,1

contractor enforce map pricing,1,5.12, $5.12 ,1

how to set map pricing amazon,1,4.69, $4.69 ,1

pricing tool,2,5.49, $5.49 ,1

amazon is breaking my map price contact us,1,6.57, $6.57 ,1

amazon minimum advertised price,1,2.84, $2.84 ,1

map pricing enforcement 3rd party,1,3.76, $3.76 ,1

violating map,1,5.88, $5.88 ,1

hp map violations,2,5.33, $5.33 ,1

best minimum advertised price software,1,12.27, $12.27 ,1

map price amazon,4,7.78, $7.78 ,1

amazon map compliance app,1,5.14, $5.14 ,1

map on amazon,0,4.79, $4.79 ,1

amazon price map,1,2.85, $2.85 ,1

gps network mapping software,7,10.33, $20.66 ,2

amazon seller map pricing check,1,3.91, $3.91 ,1

map pricing violations,1,0, $-   ,0

why would you need to register a brand,1,2.48, $2.48 ,1

jacuzzi brand enforcement,1,2.85, $2.85 ,1

brand registry check,1,3.63, $3.63 ,1

how to register your own brand,4,0, $-   ,0

jake peterson brand enforcement,2,3.77, $3.77 ,1

trandemark books amazon brand registry,1,8.33, $8.33 ,1

private investigator corporate services brand protection,1,3.54, $3.54 ,1

usda brand registry,1,3.6, $3.60 ,1

how to get your brand trademarked,21,3.03, $3.03 ,1

how to protect your logo,6,3.55, $3.55 ,1

brandshield competitors,3,3.53, $3.53 ,1

do you have to register your brand in arkansas,2,3.04, $3.04 ,1

protecting your lifestlye brand in infancy stage,1,2.98, $2.98 ,1

amazon police dept branding iron,2,2.93, $2.93 ,1

how do u buy your brand name,1,3.77, $3.77 ,1

brand registry usa,16,4.16, $8.32 ,2

brand registry usa,4,2.97, $5.94 ,2

how to protect your brand name,10,0, $-   ,0

montana brand registry,7,2.99, $2.99 ,1

how to register a name brand,7,3.35, $6.69 ,2

brand protection blogs,1,4.01, $4.01 ,1

brand register in meigs county,1,3.64, $3.64 ,1

brand register,2,0, $-   ,0

how to register a brand with amazon,2,2.42, $4.84 ,2

brand enforcement on amazon,1,1.88, $1.88 ,1

llc brand name,2,3.73, $3.73 ,1

protect the brand dababy,9,3.02, $3.02 ,1

protecting your company name and logo,3,3.56, $3.56 ,1

how to buy your brand name,11,0, $-   ,0

how to get brand eegistry amazon,1,1.68, $1.68 ,1

brand protection strategy,7,3.65, $3.65 ,1

how to register a brand,2,4.97, $4.97 ,1

protect a logo,2,4.96, $4.96 ,1

amazon brand registry requirements,6,0, $-   ,0

protect business name,10,3.62, $7.24 ,2

brand registry for cattle,1,2.92, $2.92 ,1

mississippi brand registry,1,0, $-   ,0

how to register a brand globally,1,4.01, $4.01 ,1

how do i go about protecting my logo and my pattern,1,3.6, $3.60 ,1

brand regitry,1,4.97, $4.97 ,1

register your brand cattle,1,3.24, $3.24 ,1

national cattle brand registry south dakota,1,4.63, $4.63 ,1

how do u protect a logo as par of a brand,1,3.06, $3.06 ,1

how to get a brand copyrighted,1,2.74, $2.74 ,1

amazon brand registry services,1,4.3, $4.30 ,1

b your brand,1,2.5, $2.50 ,1

us brand registry,7,3.25, $3.25 ,1

how to amazon brand registry,2,2.81, $2.81 ,1

how to protect your name and logo,4,3.73, $3.73 ,1

oregon brand registry,4,2.51, $2.51 ,1

brand tegistry elegibility,1,3, $3.00 ,1

brand registering,1,3.64, $3.64 ,1

brand registering,1,2.78, $2.78 ,1

brqnd registrar,1,3.4, $3.40 ,1

vans global brand enforcement paralegal job,1,2.68, $2.68 ,1

copyright my brand,10,3.76, $7.52 ,2

how is possible to be approved for amazon brend registry fest,1,1.13, $1.13 ,1

how to register your brand amazon,1,2.59, $2.59 ,1

copyright your brand,3,3.45, $3.45 ,1

how much is it to get brand copyright,1,2.26, $2.26 ,1

how to register my brand name,9,3.91, $3.91 ,1

protect the brand,644,2.65, $10.58 ,4

buying your brand name,2,0, $-   ,0

how to do brand registry on amazon,1,6.18, $6.18 ,1

how to apply for a new branding register,1,3.48, $3.48 ,1

how to protect my tshirt business,1,3.97, $3.97 ,1

brandverity competitors,1,2.62, $2.62 ,1

moneybagg yo protect the brand,64,2.88, $2.88 ,1

do you have to register your brand,1,3.56, $3.56 ,1

how do you protect business name,4,2.93, $2.93 ,1

register brand on amazon,1,0, $-   ,0

amazon trademark registration,7,3.49, $3.49 ,1

brand protection software,2,3.46, $6.91 ,2

how do i protect my logo,6,2.78, $2.78 ,1

global marketplace monitoring brand protection amazon,1,3.6, $3.60 ,1

fasttrack amazon brand registry,1,4.28, $4.28 ,1

amazon brand enforcement,1,3.6, $3.60 ,1

how to stop unauthorized sellers on amazon,2,2.95, $2.95 ,1

brand registry in ms,1,2.8, $2.80 ,1

how to register a brand name,1,2.89, $2.89 ,1

amazon brand registry application,5,3.29, $3.29 ,1

brandshield,7,3.1, $3.10 ,1

how do you register a brand name,1,3.08, $3.08 ,1

how to get your brand copyrighted,25,3.3, $9.89 ,3

specimens sampling for brand registry,1,3.43, $3.43 ,1

jow to resgister brand,1,2.88, $2.88 ,1

how to protect business logo,2,0, $-   ,0

what is brand registry,2,3.12, $3.12 ,1

b2b amazon brand protection,1,2.41, $2.41 ,1

how to brand register,2,3.09, $3.09 ,1

how much to register your companoes brand name,1,4.01, $4.01 ,1

how to patent your brand,3,0, $-   ,0

how to register your brand,6,0, $-   ,0

how to track amazon delivery on map,1,1.73, $1.73 ,1

average cost to enforce map pricing,1,3.35, $3.35 ,1

california minimum advertised price law,2,5.61, $5.61 ,1

amazon discounting my item below map,1,3.44, $3.44 ,1

is map legal pricing,1,3.45, $3.45 ,1

map of soul 7 pre order amazon,1,4.04, $4.04 ,1

can amazon listing enforce map,1,5.65, $5.65 ,1

how to track amazon on a map,1,3.18, $3.18 ,1

map contracts for legal binding msrp,1,3.23, $3.23 ,1

how to check amazon package on map,1,3.69, $3.69 ,1

amazon fba fee chart,2,3.3, $3.30 ,1

amazon price today low today,1,0.43, $0.43 ,1

how do i track my package from amazon on the map,1,0.78, $0.78 ,1

how to sell on amazon with map pricing,1,7.58, $7.58 ,1

map minimum advertised price,18,5.61, $11.22 ,2

force map on amazon,1,1.96, $1.96 ,1

map enforcement service,1,3.24, $3.24 ,1

amazon cost chart,1,7.98, $7.98 ,1

amazon map pricing program,1,3.35, $3.35 ,1

map violations amzaon,1,5.5, $5.50 ,1

map pricing letter for amazon 3 ps,1,4.96, $4.96 ,1

how to get amazon to stick to map price,1,5.13, $10.26 ,2

how do you dealer will map violators on amazon,1,3.63, $3.63 ,1

gas network mapping software,3,6.22, $6.22 ,1

network mapping software,18,0, $-   ,0

map violations on amazon,1,11.16, $11.16 ,1

amazon product pricing tracking chart,1,3.82, $3.82 ,1

amazon map tracking cost,1,3.04, $3.04 ,1

best map enforcment software,1,3.94, $3.94 ,1

is minimum advertised price legal,3,4.65, $4.65 ,1

map monitoring musical instruments,1,10.25, $10.25 ,1

map violation amazon,2,0, $-   ,0

amazon map pricing policy,1,3.82, $3.82 ,1

how many map of the world was sold on amazon in 2019,1,1.03, $1.03 ,1

brand registry search,31,3.24, $19.44 ,6

how to register your brand near me,1,5.8, $5.80 ,1

how to register you brand name and logo,1,3.86, $3.86 ,1

brandservices amazon,6,1.77, $1.77 ,1

brand services amazon com,1,2.43, $2.43 ,1

register your own brand,1,0, $-   ,0

amazon brand gating,1,3.04, $3.04 ,1

how to protect my logo,8,3.58, $3.58 ,1

brand registry infiringment gmail com,1,4.79, $4.79 ,1

other ways to protect your logo and brand,1,5.02, $5.02 ,1

how to get your business name protected,1,3.05, $3.05 ,1

how to register brand name,4,3.48, $3.48 ,1

trademark a brand com,1,3.07, $3.07 ,1

amazon brand tracking alerts,1,2.92, $2.92 ,1

how to protect your personal brand,1,3.48, $3.48 ,1

how to secure a brand name,8,2.34, $2.34 ,1

brand registry 2.0,2,0, $-   ,0

brand registry 2.0,1,3.58, $3.58 ,1

how to protect my business logo,3,3.06, $3.06 ,1

register your brand in the us,1,3.18, $3.18 ,1

amazon brand gating program,2,1.94, $1.94 ,1

brand regitry llc,1,2.4, $2.40 ,1

protected brand logo,23,3.22, $9.66 ,3

dewitt county brand registry,2,2.85, $2.85 ,1

tennessee brand registry,2,2.12, $2.12 ,1

brand protection law firm,2,2.51, $2.51 ,1

brand register,21,3.66, $3.66 ,1

upc brand registry,1,4.73, $4.73 ,1

brandservices amazon com,9,3.68, $7.36 ,2

louisiana boah brand registery,1,3.77, $3.77 ,1

how can i register my brand name,1,4.6, $4.60 ,1

brand protection strategy,1,3.41, $3.41 ,1

how to register a brand,122,3.46, $17.29 ,5

how to regiter a brand,1,2.94, $2.94 ,1

brand protection startups funding,5,3.7, $3.70 ,1

how to copy write a brand,1,2.99, $2.99 ,1

nstional brand registry,1,2.46, $2.46 ,1

amazon brand registry requirements,4,3.67, $3.67 ,1

brand reputation tools,1,3.53, $3.53 ,1

how to get a cow brand,1,2.97, $2.97 ,1

register brand amazon,3,4.03, $4.03 ,1

how to pertect name brand,1,4.1, $4.10 ,1

amazon vendors,1,3.16, $3.16 ,1

register brand,16,2.94, $2.94 ,1

how to protect a logo design,1,4.55, $4.55 ,1

how to register a brand for your ranch,1,3.09, $3.09 ,1

trademark your brand,45,3.34, $6.68 ,2

good screen protector brands,1,3.72, $3.72 ,1

register a brand,9,3.38, $3.38 ,1

register a brand,29,2.76, $5.52 ,2

amazon brand enforcement email template,1,4.23, $4.23 ,1

https brandservices amazon com,1,2.8, $2.80 ,1

registering your brand,2,3.03, $3.03 ,1

after registering your brand name then what,1,3.01, $3.01 ,1

do you need to register your own brand,1,2.91, $2.91 ,1

how do you regester a brand,1,4.76, $4.76 ,1

how to register a brand name on amazon,1,4.02, $4.02 ,1

how to register brand,2,3.15, $3.15 ,1

expedited brand registry amazon,1,3.12, $3.12 ,1

utah brand registry,7,2.97, $2.97 ,1

register brand name,28,2.99, $2.99 ,1

louisiana brand registry,1,2.82, $2.82 ,1

how to register a brand on amazon,2,4.49, $4.49 ,1

brand registration amazon,6,5.37, $5.37 ,1

amazon brand protection program,1,2.74, $2.74 ,1

brand approval amazon,11,0, $-   ,0

ct brand registry,4,1.83, $1.83 ,1

register brand for amazon seller,1,3.13, $6.26 ,2

what is brand registry at amazon,1,3.37, $3.37 ,1

how to make your brand legal,13,2.11, $10.57 ,5

how do i register a brand,2,3.51, $7.02 ,2

branding registry for horses,1,1.02, $1.02 ,1

what is brand registry on amazon,6,2.65, $2.65 ,1

how to register my brand on amazon,7,2.73, $2.73 ,1

how to protect your brand,2,0, $-   ,0

how to register my logo name brand,1,2.63, $2.63 ,1

register a brand in kansas,1,2.31, $2.31 ,1

brand services amazon,20,2.03, $4.06 ,2

protect my logo,4,3.46, $3.46 ,1

amazon brand registry agent,2,0, $-   ,0

us brand registry search,1,0, $-   ,0

how do i secure my brand label,1,2.96, $2.96 ,1

how do i secure my brand name,1,3.01, $3.01 ,1

how to protect a logo and brand name,1,3.68, $3.68 ,1

claiming a brand name,1,3.8, $3.80 ,1

how do you protect your business logo and brand,1,3.09, $3.09 ,1

how to register a brand name,128,3.7, $25.89 ,7

where to register a brand name,1,3.85, $3.85 ,1

state of colorado brand regestry,1,2.81, $2.81 ,1

brand registry costs,1,3.82, $3.82 ,1

can you brand patent your face,1,4.11, $4.11 ,1

lipscomb county brand registry,2,2.97, $2.97 ,1

how to trademark your brand,35,3.04, $15.18 ,5

how to register your brand,9,0, $-   ,0

brandseervices amazo,1,3.5, $3.50 ,1